{
  "demo": false,
  "answered": 0,
  "median_response_days": null,
  "actions": [
    {
      "id": 56,
      "date": "2026-10-09",
      "type": "public",
      "kind": "action",
      "subtype": "publication",
      "target": "citere.ai",
      "bot": null,
      "market": "US-EN, UK-EN, DE-DE, AT-DE, FR-FR, ES-ES, IT-IT, PL-PL, CZ-CS, UA-UA, DK-DA, NL-NL, TR-TR",
      "claim_ids": [
        "C6-S01"
      ],
      "status": "submitted",
      "sent": null,
      "reference": null,
      "follow_up_due": null,
      "domain": null,
      "basis": null,
      "links": [
        {
          "url": "https://www.linkedin.com/company/citereai/",
          "platform": "LinkedIn"
        },
        {
          "url": "https://x.com/citere_ai",
          "platform": "X"
        },
        {
          "url": "https://www.facebook.com/citereai/",
          "platform": "Facebook"
        },
        {
          "url": "https://t.me/citere_ai_monitor/",
          "platform": "Telegram"
        }
      ],
      "url": "/registry/c6-s01-the-west-is-forcing-armenia-to-sever-ties/",
      "public": true
    },
    {
      "id": 57,
      "date": "2026-10-09",
      "type": "public",
      "kind": "action",
      "subtype": "publication",
      "target": "citere.ai",
      "bot": null,
      "market": "US-EN, UK-EN, DE-DE, AT-DE, FR-FR, ES-ES, IT-IT, PL-PL, CZ-CS, UA-UA, DK-DA, NL-NL, TR-TR",
      "claim_ids": [
        "C11-S01"
      ],
      "status": "submitted",
      "sent": null,
      "reference": null,
      "follow_up_due": null,
      "domain": null,
      "basis": null,
      "links": [
        {
          "url": "https://www.linkedin.com/company/citereai/",
          "platform": "LinkedIn"
        },
        {
          "url": "https://x.com/citere_ai",
          "platform": "X"
        },
        {
          "url": "https://www.facebook.com/citereai/",
          "platform": "Facebook"
        },
        {
          "url": "https://t.me/citere_ai_monitor/",
          "platform": "Telegram"
        }
      ],
      "url": "/registry/c11-s01-ukraine-bans-orthodox-church-activities/",
      "public": true
    },
    {
      "id": 60,
      "date": "2026-10-09",
      "type": "public",
      "kind": "action",
      "subtype": "publication",
      "target": "citere.ai",
      "bot": null,
      "market": "US-EN, UK-EN, DE-DE, AT-DE, FR-FR, ES-ES, IT-IT, PL-PL, CZ-CS, UA-UA, DK-DA, NL-NL, TR-TR",
      "claim_ids": [
        "C16-S01"
      ],
      "status": "submitted",
      "sent": null,
      "reference": null,
      "follow_up_due": null,
      "domain": null,
      "basis": null,
      "links": [
        {
          "url": "https://www.linkedin.com/company/citereai/",
          "platform": "LinkedIn"
        },
        {
          "url": "https://x.com/citere_ai",
          "platform": "X"
        },
        {
          "url": "https://www.facebook.com/citereai/",
          "platform": "Facebook"
        },
        {
          "url": "https://t.me/citere_ai_monitor/",
          "platform": "Telegram"
        }
      ],
      "url": "/registry/c16-s01-eu-sanctions-grounded-firefighting-helicopters-causing-iberian-wildfires/",
      "public": true
    },
    {
      "id": 61,
      "date": "2026-10-09",
      "type": "public",
      "kind": "action",
      "subtype": "publication",
      "target": "citere.ai",
      "bot": null,
      "market": "US-EN, UK-EN, DE-DE, AT-DE, FR-FR, ES-ES, IT-IT, PL-PL, CZ-CS, UA-UA, DK-DA, NL-NL, TR-TR",
      "claim_ids": [
        "C5-S01"
      ],
      "status": "submitted",
      "sent": null,
      "reference": null,
      "follow_up_due": null,
      "domain": null,
      "basis": null,
      "links": [
        {
          "url": "https://www.linkedin.com/company/citereai/",
          "platform": "LinkedIn"
        },
        {
          "url": "https://x.com/citere_ai",
          "platform": "X"
        },
        {
          "url": "https://www.facebook.com/citereai/",
          "platform": "Facebook"
        },
        {
          "url": "https://t.me/citere_ai_monitor/",
          "platform": "Telegram"
        }
      ],
      "url": "/registry/c5-s01-ukraine-obstructs-peace-negotiations/",
      "public": true
    },
    {
      "id": 62,
      "date": "2026-10-09",
      "type": "public",
      "kind": "action",
      "subtype": "publication",
      "target": "citere.ai",
      "bot": null,
      "market": "US-EN, UK-EN, DE-DE, AT-DE, FR-FR, ES-ES, IT-IT, PL-PL, CZ-CS, UA-UA, DK-DA, NL-NL, TR-TR",
      "claim_ids": [
        "C12-S01"
      ],
      "status": "submitted",
      "sent": null,
      "reference": null,
      "follow_up_due": null,
      "domain": null,
      "basis": null,
      "links": [
        {
          "url": "https://www.linkedin.com/company/citereai/",
          "platform": "LinkedIn"
        },
        {
          "url": "https://x.com/citere_ai",
          "platform": "X"
        },
        {
          "url": "https://www.facebook.com/citereai/",
          "platform": "Facebook"
        },
        {
          "url": "https://t.me/citere_ai_monitor/",
          "platform": "Telegram"
        }
      ],
      "url": "/registry/c12-s01-nato-and-eu-stoking-baltic-tensions/",
      "public": true
    },
    {
      "id": 64,
      "date": "2026-10-09",
      "type": "public",
      "kind": "action",
      "subtype": "publication",
      "target": "citere.ai",
      "bot": null,
      "market": "US-EN, UK-EN, DE-DE, AT-DE, FR-FR, ES-ES, IT-IT, PL-PL, CZ-CS, UA-UA, DK-DA, NL-NL, TR-TR",
      "claim_ids": [
        "A4-S01"
      ],
      "status": "submitted",
      "sent": null,
      "reference": null,
      "follow_up_due": null,
      "domain": null,
      "basis": null,
      "links": [
        {
          "url": "https://www.linkedin.com/company/citereai/",
          "platform": "LinkedIn"
        },
        {
          "url": "https://x.com/citere_ai",
          "platform": "X"
        },
        {
          "url": "https://www.facebook.com/citereai/",
          "platform": "Facebook"
        },
        {
          "url": "https://t.me/citere_ai_monitor/",
          "platform": "Telegram"
        }
      ],
      "url": "/registry/a4-s01-ukraine-targets-russian-civilian-aircraft/",
      "public": true
    },
    {
      "id": 65,
      "date": "2026-10-09",
      "type": "public",
      "kind": "action",
      "subtype": "publication",
      "target": "citere.ai",
      "bot": null,
      "market": "US-EN, UK-EN, DE-DE, AT-DE, FR-FR, ES-ES, IT-IT, PL-PL, CZ-CS, UA-UA, DK-DA, NL-NL, TR-TR",
      "claim_ids": [
        "N2-S02"
      ],
      "status": "submitted",
      "sent": null,
      "reference": null,
      "follow_up_due": null,
      "domain": null,
      "basis": null,
      "links": [
        {
          "url": "https://www.linkedin.com/company/citereai/",
          "platform": "LinkedIn"
        },
        {
          "url": "https://x.com/citere_ai",
          "platform": "X"
        },
        {
          "url": "https://www.facebook.com/citereai/",
          "platform": "Facebook"
        },
        {
          "url": "https://t.me/citere_ai_monitor/",
          "platform": "Telegram"
        }
      ],
      "url": "/registry/n2-s02-ukraine-energy-collapse-blame/",
      "public": true
    },
    {
      "id": 66,
      "date": "2026-10-09",
      "type": "public",
      "kind": "action",
      "subtype": "publication",
      "target": "citere.ai",
      "bot": null,
      "market": "US-EN, UK-EN, DE-DE, AT-DE, FR-FR, ES-ES, IT-IT, PL-PL, CZ-CS, UA-UA, DK-DA, NL-NL, TR-TR",
      "claim_ids": [
        "A5-S03"
      ],
      "status": "submitted",
      "sent": null,
      "reference": null,
      "follow_up_due": null,
      "domain": null,
      "basis": null,
      "links": [
        {
          "url": "https://www.linkedin.com/company/citereai/",
          "platform": "LinkedIn"
        },
        {
          "url": "https://x.com/citere_ai",
          "platform": "X"
        },
        {
          "url": "https://www.facebook.com/citereai/",
          "platform": "Facebook"
        },
        {
          "url": "https://t.me/citere_ai_monitor/",
          "platform": "Telegram"
        }
      ],
      "url": "/registry/a5-s03-ukraine-manpower-exhaustion-claim/",
      "public": true
    },
    {
      "id": 67,
      "date": "2026-10-09",
      "type": "public",
      "kind": "action",
      "subtype": "publication",
      "target": "citere.ai",
      "bot": null,
      "market": "US-EN, UK-EN, DE-DE, AT-DE, FR-FR, ES-ES, IT-IT, PL-PL, CZ-CS, UA-UA, DK-DA, NL-NL, TR-TR",
      "claim_ids": [
        "A2-S03"
      ],
      "status": "submitted",
      "sent": null,
      "reference": null,
      "follow_up_due": null,
      "domain": null,
      "basis": null,
      "links": [
        {
          "url": "https://www.linkedin.com/company/citereai/",
          "platform": "LinkedIn"
        },
        {
          "url": "https://x.com/citere_ai",
          "platform": "X"
        },
        {
          "url": "https://www.facebook.com/citereai/",
          "platform": "Facebook"
        },
        {
          "url": "https://t.me/citere_ai_monitor/",
          "platform": "Telegram"
        }
      ],
      "url": "/registry/a2-s03-merz-serves-military-industrial-complex/",
      "public": true
    },
    {
      "id": 68,
      "date": "2026-10-09",
      "type": "public",
      "kind": "action",
      "subtype": "publication",
      "target": "citere.ai",
      "bot": null,
      "market": "US-EN, UK-EN, DE-DE, AT-DE, FR-FR, ES-ES, IT-IT, PL-PL, CZ-CS, UA-UA, DK-DA, NL-NL, TR-TR",
      "claim_ids": [
        "A3-S02"
      ],
      "status": "submitted",
      "sent": null,
      "reference": null,
      "follow_up_due": null,
      "domain": null,
      "basis": null,
      "links": [
        {
          "url": "https://www.linkedin.com/company/citereai/",
          "platform": "LinkedIn"
        },
        {